[
  {
    "id": "1442877485028081729",
    "name": "𝑯𝒊𝒓𝒐サーバー",
    "categories": [
      "illegal-tos-content"
    ],
    "note": "(通報時の補足なし)",
    "status": "listed",
    "report_count": 1,
    "added_at": "2026-09-16",
    "updated_at": "2026-09-16"
  },
  {
    "id": "1466719336776335426",
    "name": "👑Rszの宗教👾ᩚ",
    "categories": [
      "illegal-tos-content"
    ],
    "note": "(通報時の補足なし)",
    "status": "listed",
    "report_count": 1,
    "added_at": "2026-09-16",
    "updated_at": "2026-09-16"
  },
  {
    "id": "1546916571543507055",
    "name": "文字コラぶっかけ鯖💕",
    "categories": [
      "illegal-tos-content"
    ],
    "note": "(通報時の補足なし)",
    "status": "listed",
    "report_count": 1,
    "added_at": "2026-09-16",
    "updated_at": "2026-09-16"
  },
  {
    "id": "1133437944485646437",
    "name": "くろマメ-2026#SUM",
    "categories": [
      "illegal-tos-content"
    ],
    "note": "(通報時の補足なし)",
    "status": "listed",
    "report_count": 1,
    "added_at": "2026-09-15",
    "updated_at": "2026-09-15"
  },
  {
    "id": "1216303889599565875",
    "name": "ACVR￤Allied Forces",
    "categories": [
      "raid-hub"
    ],
    "note": "(通報時の補足なし)",
    "status": "listed",
    "report_count": 1,
    "added_at": "2026-09-15",
    "updated_at": "2026-09-15"
  },
  {
    "id": "1321824107154640909",
    "name": "しろなちゅ鯖",
    "categories": [
      "illegal-tos-content"
    ],
    "note": "(通報時の補足なし)",
    "status": "listed",
    "report_count": 1,
    "added_at": "2026-09-15",
    "updated_at": "2026-09-15"
  },
  {
    "id": "1393546442437824542",
    "name": "🦐海老の集いの場🦐",
    "categories": [
      "illegal-tos-content"
    ],
    "note": "(通報時の補足なし)",
    "status": "listed",
    "report_count": 1,
    "added_at": "2026-09-15",
    "updated_at": "2026-09-15"
  },
  {
    "id": "1405687426655195208",
    "name": "Ryu 𝐬𝐞𝐫𝐯𝐞𝐫",
    "categories": [
      "illegal-tos-content"
    ],
    "note": "(通報時の補足なし)",
    "status": "listed",
    "report_count": 1,
    "added_at": "2026-09-15",
    "updated_at": "2026-09-15"
  },
  {
    "id": "1411404089627119668",
    "name": "ブレロサポート鯖(SHOP運営)",
    "categories": [
      "illegal-tos-content"
    ],
    "note": "(通報時の補足なし)",
    "status": "listed",
    "report_count": 1,
    "added_at": "2026-09-15",
    "updated_at": "2026-09-15"
  },
  {
    "id": "1420924251824848988",
    "name": "ますまに共栄圏Backup｜ MSMN",
    "categories": [
      "raid-hub"
    ],
    "note": "(通報時の補足なし)",
    "status": "listed",
    "report_count": 1,
    "added_at": "2026-09-15",
    "updated_at": "2026-09-15"
  },
  {
    "id": "1441517638047240223",
    "name": "ベッドロックコミュニティー",
    "categories": [
      "illegal-tos-content"
    ],
    "note": "(通報時の補足なし)",
    "status": "listed",
    "report_count": 1,
    "added_at": "2026-09-15",
    "updated_at": "2026-09-15"
  },
  {
    "id": "1460466959853289596",
    "name": "りあさば",
    "categories": [
      "illegal-tos-content"
    ],
    "note": "(通報時の補足なし)",
    "status": "listed",
    "report_count": 1,
    "added_at": "2026-09-15",
    "updated_at": "2026-09-15"
  },
  {
    "id": "1477659933703930008",
    "name": "そう鯖",
    "categories": [
      "illegal-tos-content"
    ],
    "note": "(通報時の補足なし)",
    "status": "listed",
    "report_count": 1,
    "added_at": "2026-09-15",
    "updated_at": "2026-09-15"
  },
  {
    "id": "1481624081722769428",
    "name": "Ryu鯖",
    "categories": [
      "illegal-tos-content"
    ],
    "note": "(通報時の補足なし)",
    "status": "listed",
    "report_count": 1,
    "added_at": "2026-09-15",
    "updated_at": "2026-09-15"
  },
  {
    "id": "1485654175856459868",
    "name": "𝐑𝐢𝐢𝐤𝐮_𝐒𝐞𝐫𝐯𝐞𝐫",
    "categories": [
      "illegal-tos-content"
    ],
    "note": "(通報時の補足なし)",
    "status": "listed",
    "report_count": 1,
    "added_at": "2026-09-15",
    "updated_at": "2026-09-15"
  },
  {
    "id": "1488002090683858987",
    "name": "古明地shop〖ツムツム自動代行〗",
    "categories": [
      "illegal-tos-content"
    ],
    "note": "(通報時の補足なし)",
    "status": "listed",
    "report_count": 1,
    "added_at": "2026-09-15",
    "updated_at": "2026-09-15"
  },
  {
    "id": "1489162250601103362",
    "name": "はり鯖",
    "categories": [
      "illegal-tos-content"
    ],
    "note": "(通報時の補足なし)",
    "status": "listed",
    "report_count": 1,
    "added_at": "2026-09-15",
    "updated_at": "2026-09-15"
  },
  {
    "id": "1494977857636794439",
    "name": "Terxさば{自動代行}",
    "categories": [
      "illegal-tos-content"
    ],
    "note": "(通報時の補足なし)",
    "status": "listed",
    "report_count": 1,
    "added_at": "2026-09-15",
    "updated_at": "2026-09-15"
  },
  {
    "id": "1496511607725887700",
    "name": "𝖒𝖚𝖓𝖊'𝖘 𝖘𝖊𝖗𝖛𝖊𝖗",
    "categories": [
      "illegal-tos-content"
    ],
    "note": "(通報時の補足なし)",
    "status": "listed",
    "report_count": 1,
    "added_at": "2026-09-15",
    "updated_at": "2026-09-15"
  },
  {
    "id": "1497082105857835162",
    "name": "RA shop",
    "categories": [
      "illegal-tos-content"
    ],
    "note": "(通報時の補足なし)",
    "status": "listed",
    "report_count": 2,
    "added_at": "2026-09-15",
    "updated_at": "2026-09-15"
  },
  {
    "id": "1498288615703318650",
    "name": "Mocolshop",
    "categories": [
      "illegal-tos-content"
    ],
    "note": "(通報時の補足なし)",
    "status": "listed",
    "report_count": 1,
    "added_at": "2026-09-15",
    "updated_at": "2026-09-15"
  },
  {
    "id": "1498925069857194184",
    "name": "にろは(代行販売)",
    "categories": [
      "illegal-tos-content"
    ],
    "note": "(通報時の補足なし)",
    "status": "listed",
    "report_count": 1,
    "added_at": "2026-09-15",
    "updated_at": "2026-09-15"
  },
  {
    "id": "1501406518556364810",
    "name": "イー鯖",
    "categories": [
      "illegal-tos-content"
    ],
    "note": "(通報時の補足なし)",
    "status": "listed",
    "report_count": 1,
    "added_at": "2026-09-15",
    "updated_at": "2026-09-15"
  },
  {
    "id": "1503030201758646466",
    "name": "🤩みんなのサーバー探し🤩",
    "categories": [
      "illegal-tos-content"
    ],
    "note": "(通報時の補足なし)",
    "status": "listed",
    "report_count": 1,
    "added_at": "2026-09-15",
    "updated_at": "2026-09-15"
  },
  {
    "id": "1505409613321994391",
    "name": "Noa 鯖",
    "categories": [
      "illegal-tos-content"
    ],
    "note": "(通報時の補足なし)",
    "status": "listed",
    "report_count": 1,
    "added_at": "2026-09-15",
    "updated_at": "2026-09-15"
  },
  {
    "id": "1518587277737984142",
    "name": "かる鯖 | 代行・石垢販売",
    "categories": [
      "illegal-tos-content"
    ],
    "note": "(通報時の補足なし)",
    "status": "listed",
    "report_count": 1,
    "added_at": "2026-09-15",
    "updated_at": "2026-09-15"
  },
  {
    "id": "1520420605118251120",
    "name": "じゅんゆな💕抜サーバー💕👯",
    "categories": [
      "illegal-tos-content"
    ],
    "note": "(通報時の補足なし)",
    "status": "listed",
    "report_count": 1,
    "added_at": "2026-09-15",
    "updated_at": "2026-09-15"
  },
  {
    "id": "1525303003920466150",
    "name": "うゆSHOP",
    "categories": [
      "illegal-tos-content"
    ],
    "note": "(通報時の補足なし)",
    "status": "listed",
    "report_count": 1,
    "added_at": "2026-09-15",
    "updated_at": "2026-09-15"
  },
  {
    "id": "1527348251454341360",
    "name": "時雨鯖",
    "categories": [
      "illegal-tos-content"
    ],
    "note": "(通報時の補足なし)",
    "status": "listed",
    "report_count": 1,
    "added_at": "2026-09-15",
    "updated_at": "2026-09-15"
  },
  {
    "id": "1530223841509376203",
    "name": "NEWいふくの鯖",
    "categories": [
      "illegal-tos-content"
    ],
    "note": "(通報時の補足なし)",
    "status": "listed",
    "report_count": 1,
    "added_at": "2026-09-15",
    "updated_at": "2026-09-15"
  },
  {
    "id": "1538502356214485102",
    "name": "𝓟𝓡𝓞𝓙𝓔𝓒𝓣 𝓡𝓔𝓐𝓛𝟐",
    "categories": [
      "illegal-tos-content"
    ],
    "note": "(通報時の補足なし)",
    "status": "listed",
    "report_count": 1,
    "added_at": "2026-09-15",
    "updated_at": "2026-09-15"
  },
  {
    "id": "1547273177984405586",
    "name": "脱コラ専門コラ好き集まれ",
    "categories": [
      "illegal-tos-content"
    ],
    "note": "(通報時の補足なし)",
    "status": "listed",
    "report_count": 1,
    "added_at": "2026-09-11",
    "updated_at": "2026-09-11"
  },
  {
    "id": "1532608858269159615",
    "name": "そーCloud",
    "creator_id": "1434090932239728746",
    "categories": [
      "illegal-tos-content"
    ],
    "note": "メン爆代行の実施",
    "status": "listed",
    "report_count": 1,
    "added_at": "2026-09-07",
    "updated_at": "2026-09-07"
  },
  {
    "id": "977416124767563867",
    "name": "サポートサーバー",
    "categories": [
      "illegal-tos-content"
    ],
    "note": "shopサーバー",
    "status": "listed",
    "report_count": 1,
    "added_at": "2026-09-07",
    "updated_at": "2026-09-07"
  },
  {
    "id": "1537076398710202460",
    "name": "LE SSERAFIM💕🥵",
    "creator_id": "1536723347713564793",
    "categories": [
      "illegal-tos-content"
    ],
    "note": "NSFWサーバーです",
    "status": "listed",
    "report_count": 1,
    "added_at": "2026-08-27",
    "updated_at": "2026-08-27"
  }
]
